Company,Primary Sector,Tags,Short Description,Country,Region,Date,Quarter,Amount ($),Investment Type,TPIC,Corp Investor?,Investor 1,Investor 2,Investor 3,Investor 4,Investor 5,Investor 6,Investor 7,Investor 8,Investor 9,Investor 10,Investor 11,Investor 12,Investor 13EcoVapor Recovery Systems,Air,"Air,Hardware",Developer of  an organic waste gas capture and treatment system for the oil & gas industry,United States,North America,2014/01/08,1Q14,"$3,500,000",Series B,"$5,500,000",No,,,,,,,,,,,,,Efficient Drivetrains,Transportation,"Drive Train,Electric Vehicles,Hardware,Hybrid Electric Vehicles,Plug-in Hybrid,Transportation,Vehicle Components",Manufacturer of hybrid and electric vehicle drivetrains,United States,North America,2014/07/31,3Q14,"$3,500,000",Series A,"$3,500,000",Yes,Shanghai Gui Guo Assets Management Partnership,Silicon Valley China Venture Partners,Jinyuan Development Company,,,,,,,,,,H2Scan,Air,"Air,Pollution Monitoring",Provider of hydrogen-specific leak detection and real-time process monitoring systems,United States,North America,2014/01/29,1Q14,"$3,500,000",Growth Equity,"$23,342,531",No,Ravinia Management Company,,,,,,,,,,,,Hortau,Agriculture & Food,"Agriculture & Food,Crops,Precision Agriculture,Smart Irrigation",Developer and manufacturer of irrigation management technologies,Canada,North America,2014/04/07,2Q14,"$3,500,000",Growth Equity,"$6,500,000",No,Avrio Capital,,,,,,,,,,,,Oorja Fuel Cells,Fuel Cells & Hydrogen,"Fuel Cells,Fuel Cells & Hydrogen,Hardware,Methanol Fuel Cells",Oorja Fuel Cells is a global energy company providing scalable sustainable power from Methanol.,United States,North America,2014/02/12,1Q14,"$3,500,000",Growth Equity,"$27,195,350",No,DAG Ventures,Mingxin China Growth Fund,Spring Ventures,McKenna Ventures,Artis Capital Management,Focus Ventures,,,,,,,Qcept Technologies,Solar,"Photovoltaics (PV),Solar,Upstream PV",Developer of wafer inspection technologies capable of detecting impurities that conventional optical inspection equipment can not detect,United States,North America,2014/01/07,1Q14,"$3,500,000",Growth Equity,"$29,900,000",No,Imlay Investments,Pittco Capital Partners,,,,,,,,,,,kWantera,Energy Efficiency,"Cleanweb,Energy Efficiency,Software",Provider of energy management software,United States,North America,2014/11/26,4Q14,"$4,400,000",Series B,"$6,260,000",No,,,,,,,,,,,,,Flux Power,Energy Storage,"Batteries,Electrochemical Storage,Energy Storage,Energy Storage System Management / Optimization,Lithium-Based Batteries,Vehicle Energy Storage",Provider of energy storage and battery management technologies,United States,North America,2014/06/16,2Q14,"$3,474,000",Growth Equity,"$4,074,000",No,,,,,,,,,,,,,Transatomic Power,Nuclear,"Hardware,Nuclear",Developer of a nuclear reactor that runs on the nuclear waste of traditional reactors,United States,North America,2014/08/05,3Q14,"$3,468,000",Series A,"$4,231,000",No,Founders Fund,,,,,,,,,,,,SP3H,Conventional Fuels,"Conventional Fuel Vehicles,Conventional Fuels,Engine / Motor Sensors,Hardware,Internet of Things,Transportation,Vehicle Components",Developer of miniaturized and cost-effective fuel quality sensors for thermal engine efficiency and Quality Control in Process Industry.,France,Europe & Israel,2014/04/02,2Q14,"$3,448,000",Growth Equity,"$9,611,090",No,Truffle Capital,,,,,,,,,,,,Cima Nanotech,Advanced Materials,"Advanced Materials,Coatings,Electronics,PV Thin Film,Solar,Waste Chemicals","Developer of nanoparticle technology to develop transparent conductive coatings for touch screen applications, inkjet printing and silver nanoparticle production",Israel,Europe & Israel,2014/01/13,1Q14,"$3,441,102",Growth Equity,"$36,473,169",No,Nikko antfactory KK,,,,,,,,,,,,EnVerid Systems,Energy Efficiency,"Commercial Buildings,Efficient Heating & Cooling,Energy Efficiency,HVACR,Hardware,Smart Buildings,Software","Developer of energy saving air enhancement solutions for Heating, Ventilating and Air Conditioning (HVAC) systems",United States,North America,2014/01/23,1Q14,"$3,404,385",Growth Equity,"$3,404,385",No,,,,,,,,,,,,,Climeworks,Air,"Air,Carbon Capture and Sequestration (CCS),Hardware",Developer of technology for capturing CO2 for fuel feedstock,Switzerland,Europe & Israel,2014/04/28,2Q14,"$3,400,000",Series B,"$5,300,000",No,Zürcher Kantonalbank,,,,,,,,,,,,PodPonics,Agriculture & Food,"Agriculture & Food,Crops,Hardware,Indoor Cultivation Systems,Local Food Sourcing","Provider of innovative local agriculture produce growing solutions by re-purposing recycled shipping containers as ""Grow Pods""",United States,North America,2014/06/13,2Q14,"$3,400,000",Series A,"$7,405,000",No,New Ground Ventures,,,,,,,,,,,,Reenergise Finance,Energy Efficiency,Energy Efficiency,Independent financial services business focused on supporting the energy efficiency and renewable energy market.,United Kingdom,Europe & Israel,2014/06/25,2Q14,"$3,399,130",Growth Equity,"$3,399,130",No,UK Green Investment Bank (GIB),Sustainable Development Capital,SI Capital,,,,,,,,,,NaWaTechnologies,Advanced Materials,"Advanced Materials,Hardware",Supplier of products and materials based on organised nanostructures,France,Europe & Israel,2014/07/21,3Q14,"$3,380,862",Series A,"$3,380,862",Yes,CEA Investissement,Demeter Partners,Davanière Capital Partenaire,PACA Investissement,CPG Finance,Opus Capital Ventures,SAS (Silicon Alley Seed ) Investors,KIC InnoEnergy,,,,,Omni Water Solutions,Water & Wastewater,"Conventional Fuels,Hardware,Industrial Water,Oil & Gas,Produced Water,Water & Wastewater,Water Reclamation / Reuse,Water Technology Vendor",Developer of mobile water treatment systems for contaminated water,United States,North America,2014/02/19,1Q14,"$3,354,000",Growth Equity,"$21,704,000",No,Austin Ventures,,,,,,,,,,,,HeatMatrix Group,Energy Efficiency,"Energy Efficiency,Hardware,Industrial Efficiency,Waste Heat Recovery",Dutch company that has developed an innovative corrosion and fouling resistant polymer Heat-Exchanger / Air PreHeater for Waste Heat Recovery applications,Netherlands,Europe & Israel,2014/04/10,2Q14,"$3,265,356",Series B,"$3,265,356",No,Dutch Greentech Fund,Sirius Venture Partners,Dürr AG,Innovation and Investment Fund Gelderland (IIG),,,,,,,,,Seren Photonics,Energy Efficiency,"Commercial Buildings,Energy Efficiency,Hardware,Lighting,Lighting Materials,Smart Buildings",Developer of a processing technology that increases the amount of light generated at the heart of a high brightness light emitting diode (HBLED),United Kingdom,Europe & Israel,2014/04/08,2Q14,"$3,182,000",Series B,"$6,772,000",No,Fusion IP,IP Group,Finance Wales,,,,,,,,,,VIA Motors,Transportation,"Drive Train,Electric Vehicles,Hardware,Light-Weight Truck,Passenger Car,Transportation,Vehicle Components","Developer of electric range-extended vehicles, specifically trucks and SUVs",United States,North America,2014/01/06,1Q14,"$3,127,078",Series B,"$54,267,164",No,,,,,,,,,,,,,PetroFeed,Conventional Fuels,"Conventional Fuels,Digital Oilfield,Networking & Communication,Oil & Gas,Workflow & Knowledge Management",Provider of a well asset intelligence and networking platform for the oil & gas industry,Canada,North America,2014/04/29,2Q14,"$3,100,000",Seed,"$3,100,000",No,,,,,,,,,,,,,Mekitec,Agriculture & Food,"Agriculture & Food,Food Safety,Hardware,Quality Monitoring",Developer of x-ray food quality inspection that detects and removes physical contamination in food products,Finland,Europe & Israel,2014/03/05,1Q14,"$3,020,000",Series A,"$3,020,000",No,Inventure Capital,Finnish Industry Investment,,,,,,,,,,,LanzaTech,Biofuels & Biochemicals,"Advanced Materials,Agricultural Residue,Air,Biofuel Conversion,Biofuels & Biochemicals,Biological Conversion,Biomass Deconstruction,Carbon Capture and Sequestration (CCS),Cellulosic Biomass,Cellulosic Ethanol,Conventional Fuels,Ethanol,Fermentation,Forest Residue,GTL,Gasification,Global Cleantech 100 (2010),Global Cleantech 100 (2011),Global Cleantech 100 (2012),Global Cleantech 100 (2013),Global Cleantech 100 (2014),Industrial Biotech,Industrial Waste,Liquefaction,Municipal Solid Waste,Syngas,Thermal Deconstruction",Developer of a carbon capture and reuse technology that transforms abundant waste and low-cost resources into low carbon fuels and chemicals,United States,North America,2014/12/08,4Q14,"$60,000,000",Growth Equity,"$210,000,000",No,New Zealand Superannuation Fund,,,,,,,,,,,,FarmedHere,Agriculture & Food,"Agriculture & Food,Aquaponics,Crops,Indoor Cultivation Systems,Local Food Sourcing,Vertical Farming",Provider of fresh-locally grown vegetables to supermarkets in the Illinois area,United States,North America,2014/09/19,3Q14,"$3,000,000",Series B,"$3,000,000",No,,,,,,,,,,,,,Graphene Technologies,Advanced Materials,"Advanced Materials,Fullerenes,Graphene,Hardware,Nanomaterials",Graphene Technologies has developed a graphene synthesis technology that scalably produces high quality graphene and unique graphene composites using carbon dioxide (CO2) as a feedstock.,United States,North America,2014/03/04,1Q14,"$3,000,000",Series A,"$7,250,000",No,,,,,,,,,,,,,NewCO2Fuels,Other Cleantech,"Advanced Materials,Air,Carbon Capture and Sequestration (CCS),Carbon Dioxide (CO2),Conventional Fuels,GTL,Gasification,Hardware,Liquefaction,Other Cleantech,Pollution Prevention,Solar,Solar Thermal,Solar Thermal Process Heat / Steam,Syngas",Developer of technology that uses thermal energy from renewable sources to convert CO2 emissions into fuel,Israel,Europe & Israel,2014/06/15,2Q14,"$3,000,000",Series B,"$12,000,000",No,,,,,,,,,,,,,Other Machine,Advanced Materials,"3D Printing,Advanced Manufacturing,Advanced Materials,Hardware",Developer of a desktop 3D-cutter,United States,North America,2014/06/19,2Q14,"$3,000,000",Series A,"$3,311,000",No,Slow Ventures,VegasTechFund,Core Ventures Group,Allegro Venture Partners,CrunchFund,,,,,,,,Paper Battery Company,Energy Storage,"Capacitors,Consumer Electronics Energy Storage,Energy Storage,Hardware,Mechanical/Electrical Storage","Developer of a printed thin and flexible, patternable supercapacitor that can be used to extend battery life",United States,North America,2014/06/09,2Q14,"$3,000,000",Series A,"$5,822,414",No,Caerus Ventures,TYLT Lab,Tom Baruch,,,,,,,,,,PsomasFMG,Solar,"Commercial Scale,Downstream PV,Financing,Ground-Mounted PV,Photovoltaics (PV),Project Development,Rooftop PV,Solar,Systems Integration","Developer of large commercial scale solar power projects with a focus on government, education, and commercial markets",United States,North America,2014/01/09,1Q14,"$3,000,000",Series A,"$10,000,000",No,,,,,,,,,,,,,RigUp,Conventional Fuels,"Conventional Fuels,Digital Oilfield,Networking & Communication,Oil & Gas,Software,Workflow & Knowledge Management",Developer of a software platform for oil rig logistics,United States,North America,2014/06/04,2Q14,"$3,000,000",Seed,"$3,000,000",No,Founders Fund,BoxGroup,Great Oaks Venture Capital,,,,,,,,,,Terralux,Energy Efficiency,"Energy Efficiency,Hardware,Lighting,Smart Buildings,Smart Home",Developer and manufacturer of LED based lighting subsystems,United States,North America,2014/07/17,3Q14,"$3,000,000",Growth Equity,"$33,450,000",No,,,,,,,,,,,,,WeSpire,Energy Efficiency,"Cleanweb,Energy Efficiency,Other Cleantech,Software",Cloud-based engagement platform that companies use to engage employees in sustainability and other positive behavior change initiatives ,United States,North America,2014/01/31,1Q14,"$3,000,000",Series A,"$4,750,000",No,Pan Asia Solar,Clean Energy Venture Group,CommonAngels,Launchpad Venture Group,,,,,,,,,Cobalt Technologies,Biofuels & Biochemicals,"Agricultural Residue,Biochemical Deconstruction,Biochemicals,Biofuel Conversion,Biofuels & Biochemicals,Biological Conversion,Biomass Deconstruction,Butanol,Cellulosic Biomass,Drop-in Fuels,Fermentation,Forest Residue,Hydrolysis,Industrial Biotech,Non-Food Crops","Developer of a commercial biobutanol production process which increases yield and fermentation rates, and reduces water and energy requirements",United States,North America,2014/05/28,2Q14,"$2,891,851",Growth Equity,"$106,487,005",No,VantagePoint Capital Partners,Pinnacle Ventures,,,,,,,,,,,VIA Motors,Transportation,"Drive Train,Electric Vehicles,Hardware,Light-Weight Truck,Passenger Car,Transportation,Vehicle Components","Developer of electric range-extended vehicles, specifically trucks and SUVs",United States,North America,2014/04/16,2Q14,"$2,886,786",Series B,"$54,267,164",No,,,,,,,,,,,,,LineaZen,Advanced Materials,"Advanced Materials,Framing,Green Building & Construction",Designer and manufacturer of integrated wooden building systems using sustainable cross laminated timber made of bamboo or beech,France,Europe & Israel,2014/09/18,3Q14,"$2,840,000",Growth Equity,"$4,410,000",No,CapAgro,Emertec,Forinvest,,,,,,,,,,Grafoid,Advanced Materials,"Advanced Materials,Fullerenes,Graphene,Nanomaterials","Researcher, developer and investor in processes that produce economically scalable graphene",Canada,North America,2014/07/08,3Q14,"$2,775,000",Growth Equity,"$6,307,000",No,PHX Financial,,,,,,,,,,,,Consumer Physics,Agriculture & Food,"Agriculture & Food,Food Safety,Hardware,Software",,United States,North America,2014/06/15,2Q14,"$2,760,000",Seed,"$3,760,000",No,Kickstarter,,,,,,,,,,,,AirSynergy,Wind,"Hardware,Horizontal Axis Wind Turbine,Large-Scale Wind,Onshore Wind,Small-Scale Wind,Wind",Developer of shrouded wind turbine technology for distributed generation applications,Ireland,Europe & Israel,2014/02/28,1Q14,"$2,750,000",Series B,"$6,750,000",No,Daniel Ahern,Gerry Ryan,Brendan Ahern,,,,,,,,,,Algaeon,Agriculture & Food,"Agriculture,Agriculture & Food,Algae,Animal Feed & Supplements,Animal Health,Aquaculture,Biofuels & Biochemicals,Cattle,Dairy,Feedstock Producer,Industrial Biotech,Livestock,Livestock Types,Oils,Pigs",Developer of algae-based animal feed and nutraceuticals,United States,North America,2014/05/12,2Q14,"$2,750,000",Growth Equity,"$4,401,062",No,City Securities Corporation,BioCrossroads,Bromet Capital Partners,,,,,,,,,,Edisun Heliostats,Solar,"Concentrating Solar Power (CSP),Hardware,Solar,Solar Power Tower,Solar Thermal",Developer of heliostat technology for solar thermal power applications,United States,North America,2014/04/17,2Q14,"$2,750,000",Series A,"$4,175,000",No,Idealab,,,,,,,,,,,,G2mobility,Transportation,"Charge Stations & Infrastructure,Hardware,Transportation,Transportation Infrastructure",Developer of electric vehicle charging infrastructure and provider of electrical mobility solutions,France,Europe & Israel,2014/05/12,2Q14,"$2,750,000",Series A,"$2,750,000",No,BPIFrance,Innovacom S.A.,CDC Climat,,,,,,,,,,Qualisteo,Smart Grid,"Building Energy Management Systems,Commercial Buildings,Energy Efficiency,Enterprise Energy Management,Internet of Things,Power Grid,Smart Buildings,Smart Grid,Software",Developer of a monitoring and control system for affordable building energy efficiency management,France,Europe & Israel,2014/02/17,1Q14,"$2,750,000",Series A,"$2,750,000",No,Demeter Partners,Emertec,,,,,,,,,,,Microphyt,Biomass Generation,Biomass Generation,Industrial scale producer of microalgaes biomass and extract,France,Europe & Israel,2014/02/24,1Q14,"$2,740,000",Series A,"$2,740,000",No,CEA Investissement,Sofimac Partners,Soridec,,,,,,,,,,GroundMetrics,Conventional Fuels,"Conventional Fuels,Digital Oilfield,Exploration & Geoscience,Geothermal,Life of Field Monitoring,Oil & Gas,Oil & Gas Production,Water & Wastewater","Provider of  survey and monitoring services for mineral, oil & gas, geothermal, and groundwater exploration, management and production, in addition to shale oil/gas basin and permafrost mapping, among other applications",United States,North America,2014/04/23,2Q14,"$2,730,000",Series B,"$7,623,590",No,Cowboy Technology Angels,,,,,,,,,,,,Exoes,Energy Efficiency,"Energy Efficiency,Hardware,Industrial Efficiency,Waste Heat Recovery",Developer of a compact heat to power engine,France,Europe & Israel,2014/05/28,2Q14,"$2,720,000",Growth Equity,"$3,740,000",No,Credit Agricole,Monestier Capital,,,,,,,,,,,BoMill,Agriculture & Food,"Agriculture & Food,Crop Types,Crops,Food Processing,Grains","Developer of TriQ technology that analyses and identifies each kernel of a batch of grain, seeds or other granular material and segregates them",Sweden,Europe & Israel,2014/07/04,3Q14,"$2,700,000",Growth Equity,"$2,700,000",No,Industrifonden,,,,,,,,,,,,Micropelt,Energy Efficiency,"Commercial Buildings,Efficient Electronics,Efficient Heating & Cooling,Energy Efficiency,Smart Buildings",Developer of thermal energy harvesting and perpetual power supplies for self contained devices,Germany,Europe & Israel,2014/06/03,2Q14,"$2,700,000",Growth Equity,"$11,280,000",Yes,Ludgate Investments,Wika,,,,,,,,,,,OpenField,Conventional Fuels,"Conventional Fuels,Hardware",developer of micro instruments for measurement in harsh environments,France,Europe & Israel,2014/05/06,2Q14,"$2,700,000",Growth Equity,"$2,700,000",Yes,Total Energy Ventures,,,,,,,,,,,,Redlen Technologies,Solar,"Cadmium Telluride (CdTe),PV Thin Film,Photovoltaics (PV),Solar",Manufacturer of high resolution semiconductor radiation detectors and advanced thin film solar feedstock products.,Canada,North America,2014/02/14,1Q14,"$2,700,000",Growth Equity,"$8,200,000",No,,,,,,,,,,,,,Scutum,Transportation,"Electric Vehicles,Hardware,Scooter,Transportation",Maker of electric scooters,Spain,Europe & Israel,2014/04/17,2Q14,"$2,700,000",Series A,"$2,700,000",Yes,Caixa Capital Risc,Repsol New Energy Ventures,CDTI-Centro Para El Desarrollo Technologico Industrial,,,,,,,,,,Volta Charging,Transportation,"Services,Transportation",Promoter of free electric vehicle charging through partnerships with advertising sponsors,United States,North America,2014/06/16,2Q14,"$2,700,000",Seed,"$2,700,000",No,,,,,,,,,,,,,640Labs,Agriculture & Food,"Agriculture & Food,Crops,Precision Agriculture,Sensors,Software","Provides a tool for farmers and ag professionals using analytics, mobile technologies and cloud computing",United States,North America,2014/07/07,3Q14,"$2,650,000",Seed,"$2,650,000",No,,,,,,,,,,,,,Farmeron,Agriculture & Food,"Agriculture & Food,Agriculture Software,Cleanweb,Crops,Software",Developer of software to help farmers manage resources and track production,United States,North America,2014/06/04,2Q14,"$2,650,000",Seed,"$4,258,689",No,NextView Ventures,SoftTech VC,,,,,,,,,,,Shuddle,Transportation,"Software,Transportation",Developer of an app to coordinate rideshare for children between various activities,United States,North America,2014/04/28,2Q14,"$2,650,000",Seed,"$2,650,000",No,Forerunner Ventures,,,,,,,,,,,,LeddarTech,Energy Efficiency,"Energy Efficiency,Hardware,Lighting","Provider of detection and ranging systems based on LED lighting for transportation, automotive and industrial markets.",Canada,North America,2014/11/18,4Q14,"$7,000,000",Series B,"$9,500,000",No,Business Development Bank of Canada (BDC) Venture Capital,GO Capital,,,,,,,,,,,Methes Energies,Biofuels & Biochemicals,"Biodiesel,Biofuels & Biochemicals,Hardware,Industrial Biotech,Services,Software,Turnkey Developer",Provider of solutions to biodiesel producers,United States,North America,2014/01/14,1Q14,"$2,612,321",Series B,"$4,312,321",No,,,,,,,,,,,,,Swift Navigation,Agriculture & Food,"Agriculture & Food,Crops,Hardware,Precision Agriculture,Steering Guidance,UAV",Developer of an affordable centimeter accurate GPS chip,United States,North America,2014/08/21,3Q14,"$2,600,000",Series A,"$2,766,000",Yes,First Round Capital,Fall Line Capital,Felicis Ventures,Lemnos Labs,Qualcomm Ventures,VegasTechFund,Kal Vepuri,,,,,,Skeleton Technologies,Energy Storage,"Capacitors,Energy Storage,Grid Energy Storage,Hardware,Mechanical/Electrical Storage,Power Grid",Europe's leading manufacturer and developer of ultracapacitors. Companies SkelCap ultracapactiors are based on patented materials technology and novel ultracapacitor design. Based in,Germany,Europe & Israel,2014/08/01,3Q14,"$2,550,000",Series A,"$5,450,000",No,Up Invest,,,,,,,,,,,,enModus,Energy Efficiency,"Cleanweb,Energy Efficiency,Internet of Things,PLC,Smart Buildings,Smart Home,Software",Developer of connected home technology,United Kingdom,Europe & Israel,2014/02/17,1Q14,"$2,510,000",Seed,"$4,110,000",No,Andromeda Capital,Finance Wales,,,,,,,,,,,American Aerogel,Advanced Materials,"Advanced Materials,Polymers",Developer of aerogel insulation solutions for shipping bio-pharmaceuticals and refrigeration,United States,North America,2014/04/18,2Q14,"$2,500,000",Growth Equity,"$31,190,811",No,Mount Royal Ventures,,,,,,,,,,,,Boatbound,Transportation,"Cleanweb,Shipping & Watercraft,Software,Transportation",Developer of online peer-to-peer marketplace for boat rentals,United States,North America,2014/04/02,2Q14,"$2,500,000",Series A,"$3,500,000",Yes,Brunswick Corporation,OurCrowd,Laszlo Bock,John Thomas,,,,,,,,,eCurv,Energy Efficiency,"Commercial Buildings,Energy Efficiency,Smart Buildings,Software",Developer of commercial building energy management software,United States,North America,2014/06/24,2Q14,"$2,500,000",Series A,"$2,500,000",Yes,Constellation Technology Ventures,Vodia Ventures,Massachusetts Clean Energy Center (MassCEC),,,,,,,,,,Lightning Hybrids,Transportation,Transportation,"Lightning Hybrids makes innovative hydraulic hybrid drive and brake retarder systems for fleet vehicles like shuttle buses, delivery vehicles and work trucks.",United States,North America,2014/11/05,4Q14,,Growth Equity,"$750,000",No,,,,,,,,,,,,,Luxe,Transportation,"Parking Management,Software,Transportation,Transportation Software",Provider of on demand valet services via an app,United States,North America,2014/10/24,4Q14,"$5,500,000",Seed,"$5,500,000",Yes,Google Ventures,Sherpa Ventures,Redpoint Ventures,Lightspeed Venture Partners,Upfront Ventures,Foundation Capital,BoxGroup,Slow Ventures,Data Collective,Eniac Ventures,,,Sensys Networks,Transportation,"Cleanweb,Congestion Monitoring,Internet of Things,Traffic Monitoring,Transportation,Transportation Software","Developer of traffic management systems using wireless, pavement-mounted sensors to detect vehicles",United States,North America,2014/03/10,1Q14,"$2,500,000",Growth Equity,"$22,100,000",Yes,Horizon Ventures,Siemens Venture Capital (SVC),Voyager Capital,Fuse Capital,,,,,,,,,Metal Membranes,Water & Wastewater,"Advanced Materials,Filtration / Separation / Purification,Industrial Water,Membrane Water Treatment,Water & Wastewater",Manufacturer of inorganic porous membrane technology for liquid and gas filtration,Netherlands,Europe & Israel,2014/10/27,4Q14,,Growth Equity,,No,ICOS Capital,,,,,,,,,,,,MicaSense,Agriculture & Food,"Agriculture & Food,Crops,Precision Agriculture,Sensors,UAV",Developer of sensors for use by UAV systems in agricultural analysis,United States,North America,2014/11/24,4Q14,"$2,000,000",Series A,"$2,000,000",Yes,Parrot,,,,,,,,,,,,TrickleStar,Energy Efficiency,"Building Energy Management Systems,Commercial Buildings,Energy Efficiency,Enterprise Energy Management,Hardware,Smart Buildings",Manufacturer of sensor-enabled power strips designed to eliminate stand-by power draw,United States,North America,2014/08/27,3Q14,"$2,500,000",Series B,"$5,500,000",No,Law Cheok Chin,,,,,,,,,,,,Breakwater Valve Systems,Water & Wastewater,"Conventional Fuels,Hardware,Industrial Water,Oil & Gas,Oil & Gas Production,Produced Water,Wastewater Treatment,Water & Wastewater,Water Technology Vendor",Developer of micro-cavitation technology for treatment of oilfield produced water,United States,North America,2014/04/22,2Q14,"$2,490,000",Seed,"$2,490,000",No,,,,,,,,,,,,,Multiphoton Optics,Advanced Materials,Advanced Materials,provider 3D Lithography Equipment for manufacturing of optical packages,Germany,Europe & Israel,2014/12/11,4Q14,"$915,000",Seed,"$915,000",No,High-Tech Gründerfonds Management,Fraunhofer Venture Group,,,,,,,,,,,Ynsect,Biofuels & Biochemicals,"Agriculture,Agriculture & Food,Aquaculture,Biofuels & Biochemicals,Biotechnology,Biotechnology Developer,Industrial Biotech","Developer of bioconversion solutions of organic resources by insects for feed and non-food applications (organic fertilizers, bioenergy…)",France,Europe & Israel,2014/03/04,1Q14,"$2,474,000",Seed,"$9,324,000",No,Emertec,Demeter Partners,,,,,,,,,,,Nagare Membranes,Water & Wastewater,"Desalination,Membrane Water Treatment,Water & Wastewater",Developer of membranes for desalinization,United States,North America,2014/12/08,4Q14,"$10,500,000",Series A,"$10,500,000",No,,,,,,,,,,,,,Enertime,Energy Efficiency,"Biomass Generation,Concentrating Solar Power (CSP),Energy Efficiency,Geothermal,Hardware,Industrial Efficiency,Waste Heat Recovery","Provider of proprietary Organic Rankine Cycle technology for MW-size waste heat recovery, geothermal, biomass and solar thermal applications",France,Europe & Israel,2014/07/22,3Q14,"$2,420,000",Series B,"$4,220,000",No,Siparex,Calao Finance,,,,,,,,,,,BiologiQ,Biofuels & Biochemicals,"Advanced Materials,Bio-based Plastics,Biochemicals,Biodegradable Products,Biofuels & Biochemicals,Hardware,Industrial Biotech,Plastics,Polymers,Polymers & Coatings,Recycling & Waste",Maker of biodegradable plastic resins from renewable resources,United States,North America,2014/01/15,1Q14,"$2,406,000",Growth Equity,"$5,706,000",No,,,,,,,,,,,,,BrightFarms,Agriculture & Food,"Agriculture & Food,Crops,Greenhouses,Hardware,Hydroponics,Indoor Cultivation Systems","Designer, builder and operator of hydroponic greenhouse farms at supermarkets",United States,North America,2014/06/04,2Q14,"$2,400,000",Series B,"$11,600,000",No,Emil Capital Partners,NGEN Partners,WP Global Partners,,,,,,,,,,